{
  "id": "estonia",
  "name": "爱沙尼亚",
  "name_en": "Estonia",
  "name_local": "Eesti",
  "code_iso_3166_1": "EE",
  "code_iso_3166_3": "EST",
  "region": "europe",
  "sub_region": "northern_europe",
  "is_digital_nomad_friendly": true,
  "has_digital_nomad_visa": true,
  "coordinates": {
    "lat": 58.5953,
    "lon": 25.0136
  },
  "timezone": [
    "Europe/Tallinn"
  ],
  "currency": [
    {
      "code": "EUR",
      "name": "欧元",
      "is_primary": true
    }
  ],
  "languages": [
    {
      "code": "et",
      "name": "爱沙尼亚语",
      "is_official": true
    }
  ],
  "population": 1330000,
  "area_km2": 45228,
  "gdp_per_capita_usd": 30000,
  "hdi": 0.89,
  "safety_index": 78.0,
  "internet_speed_avg_mbps": 100,
  "cost_of_living_index": 60.0,
  "rent_index": 25.0,
  "china_passport_visa_status": "evisa",
  "china_passport_visa_note": "电子签申根入境；e-Residency数字公民；数字游民签证",
  "digital_nomad_score": 80,
  "tags": [
    "digital",
    "e_residency",
    "eu",
    "nomad_visa",
    "startup",
    "europe"
  ],
  "status": "published",
  "updated_at": "2026-01-15T00:00:00Z",
  "source": "Numbeo 2026, World Bank 2025, Estonia e-Residency"
}