{
  "id": "austria",
  "name": "奥地利",
  "name_en": "Austria",
  "name_local": "Österreich",
  "code_iso_3166_1": "AT",
  "code_iso_3166_3": "AUT",
  "region": "europe",
  "sub_region": "中欧",
  "is_special_admin_region": false,
  "is_digital_nomad_friendly": true,
  "has_digital_nomad_visa": true,
  "coordinates": {
    "lat": 47.5162,
    "lon": 14.5501
  },
  "timezone": [
    "Europe/Vienna"
  ],
  "currency": [
    {
      "code": "EUR",
      "name": "欧元",
      "is_primary": true
    }
  ],
  "languages": [
    {
      "code": "de",
      "name": "德语",
      "is_official": true
    }
  ],
  "population": 9000000,
  "area_km2": 83871,
  "gdp_per_capita_usd": 55000,
  "hdi": 0.926,
  "safety_index": 83,
  "internet_speed_avg_mbps": 80,
  "cost_of_living_index": 70,
  "rent_index": 40,
  "china_passport_visa_status": "visa_required",
  "china_passport_visa_note": "需提前申请申根签证。奥地利提供数字游民签证（Rot-Weiß-Rot Karte für Selbstständige）",
  "digital_nomad_score": 76,
  "tags": [
    "欧洲",
    "申根",
    "数字游民签证",
    "阿尔卑斯",
    "音乐"
  ],
  "status": "published",
  "updated_at": "2026-01-15",
  "source": "Numbeo, World Bank"
}