{
  "id": "canada",
  "name": "加拿大",
  "name_en": "Canada",
  "name_local": "Canada",
  "code_iso_3166_1": "CA",
  "code_iso_3166_3": "CAN",
  "region": "americas_north",
  "sub_region": "northern_america",
  "is_digital_nomad_friendly": true,
  "has_digital_nomad_visa": false,
  "coordinates": {
    "lat": 56.1304,
    "lon": -106.3468
  },
  "timezone": [
    "America/Toronto",
    "America/Vancouver"
  ],
  "currency": [
    {
      "code": "CAD",
      "name": "加元",
      "is_primary": true
    }
  ],
  "languages": [
    {
      "code": "en",
      "name": "English",
      "is_official": true
    },
    {
      "code": "fr",
      "name": "French",
      "is_official": true
    }
  ],
  "population": 38250000,
  "area_km2": 9984670,
  "gdp_per_capita_usd": 53000,
  "hdi": 0.936,
  "safety_index": 65.0,
  "internet_speed_avg_mbps": 170,
  "cost_of_living_index": 75.0,
  "rent_index": 45.0,
  "china_passport_visa_status": "visa_required",
  "china_passport_visa_note": "旅游签证可在线申请；EE快速通道技术移民",
  "digital_nomad_score": 77,
  "tags": [
    "english",
    "immigration_friendly",
    "nature",
    "americas",
    "high_quality"
  ],
  "status": "published",
  "updated_at": "2026-01-15T00:00:00Z",
  "source": "Numbeo 2026, World Bank 2025, IRCC Canada"
}