{
  "id": "georgia",
  "name": "格鲁吉亚",
  "name_en": "Georgia",
  "name_local": "საქართველო",
  "code_iso_3166_1": "GE",
  "code_iso_3166_3": "GEO",
  "region": "asia",
  "sub_region": "西亚",
  "is_special_admin_region": false,
  "is_digital_nomad_friendly": true,
  "has_digital_nomad_visa": false,
  "coordinates": {"lat": 42.3154, "lon": 43.3569},
  "timezone": ["Asia/Tbilisi"],
  "currency": [{"code": "GEL", "name": "格鲁吉亚拉里", "is_primary": true}],
  "languages": [{"code": "ka", "name": "格鲁吉亚语", "is_official": true}, {"code": "en", "name": "英语", "is_official": false}, {"code": "ru", "name": "俄语", "is_official": false}],
  "population": 3700000,
  "area_km2": 69700,
  "gdp_per_capita_usd": 7000,
  "hdi": 0.802,
  "safety_index": 72,
  "internet_speed_avg_mbps": 35,
  "cost_of_living_index": 28,
  "rent_index": 12,
  "china_passport_visa_status": "visa_free",
  "china_passport_visa_note": "中国公民免签入境，可停留30天",
  "digital_nomad_score": 82,
  "tags": ["免签", "低成本", "欧洲风情", "高加索", "葡萄酒"],
  "status": "published",
  "updated_at": "2026-01-15",
  "source": "Numbeo, World Bank, 格鲁吉亚外交部"
}