{
  "id": "philippines",
  "name": "菲律宾",
  "name_en": "Philippines",
  "name_local": "Pilipinas",
  "code_iso_3166_1": "PH",
  "code_iso_3166_3": "PHL",
  "region": "asia",
  "sub_region": "东南亚",
  "is_special_admin_region": false,
  "is_digital_nomad_friendly": true,
  "has_digital_nomad_visa": false,
  "coordinates": {"lat": 12.8797, "lon": 121.7740},
  "timezone": ["Asia/Manila"],
  "currency": [{"code": "PHP", "name": "菲律宾比索", "is_primary": true}],
  "languages": [{"code": "tl", "name": "他加禄语", "is_official": true}, {"code": "en", "name": "英语", "is_official": true}],
  "population": 114000000,
  "area_km2": 343448,
  "gdp_per_capita_usd": 3500,
  "hdi": 0.699,
  "safety_index": 55,
  "internet_speed_avg_mbps": 30,
  "cost_of_living_index": 35,
  "rent_index": 15,
  "china_passport_visa_status": "visa_required",
  "china_passport_visa_note": "需提前申请签证，可停留30天。持有美国/日本/申根/澳洲/加拿大签证者可免签7天",
  "digital_nomad_score": 74,
  "tags": ["东南亚", "英语", "低成本", "海岛", "潜水"],
  "status": "published",
  "updated_at": "2026-01-15",
  "source": "Numbeo, World Bank, 菲律宾移民局"
}