{
  "id": "israel",
  "name": "以色列",
  "name_en": "Israel",
  "name_local": "ישראל",
  "code_iso_3166_1": "IL",
  "code_iso_3166_3": "ISR",
  "region": "middle_east",
  "sub_region": "middle_east",
  "is_digital_nomad_friendly": true,
  "has_digital_nomad_visa": false,
  "coordinates": {
    "lat": 32.0853,
    "lon": 34.7818
  },
  "timezone": [
    "Asia/Jerusalem"
  ],
  "currency": [
    {
      "code": "ILS",
      "name": "以色列新谢克尔",
      "is_primary": true
    }
  ],
  "languages": [
    {
      "code": "he",
      "name": "希伯来语",
      "is_official": true
    },
    {
      "code": "ar",
      "name": "阿拉伯语",
      "is_official": true
    }
  ],
  "population": 9500000,
  "area_km2": 20770,
  "gdp_per_capita_usd": 55000,
  "hdi": 0.919,
  "safety_index": 65.0,
  "internet_speed_avg_mbps": 130,
  "cost_of_living_index": 80.0,
  "rent_index": 45.0,
  "china_passport_visa_status": "visa_required",
  "china_passport_visa_note": "需提前申请签证，审查较严格",
  "digital_nomad_score": 75,
  "tags": [
    "middle_east",
    "startup",
    "tech",
    "beach",
    "innovation"
  ],
  "status": "published",
  "updated_at": "2026-01-15T00:00:00Z",
  "source": "Numbeo 2026, World Bank 2025"
}
