{
  "id": "nepal",
  "name": "尼泊尔",
  "name_en": "Nepal",
  "name_local": "नेपाल",
  "code_iso_3166_1": "NP",
  "code_iso_3166_3": "NPL",
  "region": "asia",
  "sub_region": "南亚",
  "is_special_admin_region": false,
  "is_digital_nomad_friendly": true,
  "has_digital_nomad_visa": false,
  "coordinates": {
    "lat": 28.3949,
    "lon": 84.124
  },
  "timezone": [
    "Asia/Kathmandu"
  ],
  "currency": [
    {
      "code": "NPR",
      "name": "尼泊尔卢比",
      "is_primary": true
    }
  ],
  "languages": [
    {
      "code": "ne",
      "name": "尼泊尔语",
      "is_official": true
    },
    {
      "code": "en",
      "name": "英语",
      "is_official": false
    }
  ],
  "population": 30000000,
  "area_km2": 147181,
  "gdp_per_capita_usd": 1300,
  "hdi": 0.602,
  "safety_index": 65,
  "internet_speed_avg_mbps": 15,
  "cost_of_living_index": 22,
  "rent_index": 8,
  "china_passport_visa_status": "visa_free",
  "china_passport_visa_note": "中国公民免签入境，可停留30天",
  "digital_nomad_score": 71,
  "tags": [
    "南亚",
    "免签",
    "喜马拉雅",
    "徒步",
    "佛教"
  ],
  "status": "published",
  "updated_at": "2026-01-15",
  "source": "Numbeo, World Bank"
}