{
  "id": "kazakhstan",
  "name": "哈萨克斯坦",
  "name_en": "Kazakhstan",
  "name_local": "Қазақстан",
  "code_iso_3166_1": "KZ",
  "code_iso_3166_3": "KAZ",
  "region": "asia",
  "sub_region": "中亚",
  "is_special_admin_region": false,
  "is_digital_nomad_friendly": true,
  "has_digital_nomad_visa": false,
  "coordinates": {
    "lat": 48.0196,
    "lon": 66.9237
  },
  "timezone": [
    "Asia/Almaty"
  ],
  "currency": [
    {
      "code": "KZT",
      "name": "坚戈",
      "is_primary": true
    }
  ],
  "languages": [
    {
      "code": "kk",
      "name": "哈萨克语",
      "is_official": true
    },
    {
      "code": "ru",
      "name": "俄语",
      "is_official": false
    }
  ],
  "population": 19000000,
  "area_km2": 2724900,
  "gdp_per_capita_usd": 10000,
  "hdi": 0.811,
  "safety_index": 72,
  "internet_speed_avg_mbps": 40,
  "cost_of_living_index": 30,
  "rent_index": 12,
  "china_passport_visa_status": "visa_free",
  "china_passport_visa_note": "中国公民免签入境，可停留30天（2023-2025年免签政策延长）",
  "digital_nomad_score": 75,
  "tags": [
    "中亚",
    "免签",
    "丝绸之路",
    "草原",
    "航天"
  ],
  "status": "published",
  "updated_at": "2026-01-15",
  "source": "Numbeo, World Bank"
}