{
  "id": "croatia",
  "name": "克罗地亚",
  "name_en": "Croatia",
  "name_local": "Hrvatska",
  "code_iso_3166_1": "HR",
  "code_iso_3166_3": "HRV",
  "region": "europe",
  "sub_region": "东南欧",
  "is_special_admin_region": false,
  "is_digital_nomad_friendly": true,
  "has_digital_nomad_visa": true,
  "coordinates": {"lat": 45.1, "lon": 15.2},
  "timezone": ["Europe/Zagreb"],
  "currency": [{"code": "EUR", "name": "欧元", "is_primary": true}],
  "languages": [{"code": "hr", "name": "克罗地亚语", "is_official": true}, {"code": "en", "name": "英语", "is_official": false}],
  "population": 3900000,
  "area_km2": 56594,
  "gdp_per_capita_usd": 18000,
  "hdi": 0.851,
  "safety_index": 78,
  "internet_speed_avg_mbps": 55,
  "cost_of_living_index": 48,
  "rent_index": 22,
  "china_passport_visa_status": "evisa",
  "china_passport_visa_note": "需提前申请申根签证（克罗地亚已加入申根区），有效期90天",
  "digital_nomad_score": 75,
  "tags": ["申根区", "地中海", "数字游民签证", "海滨生活", "欧盟"],
  "status": "published",
  "updated_at": "2026-01-15",
  "source": "Numbeo, World Bank, 克罗地亚数字游民签证官网"
}