{
  "id": "ghana",
  "name": "加纳",
  "name_en": "Ghana",
  "name_local": "Ghana",
  "code_iso_3166_1": "GH",
  "code_iso_3166_3": "GHA",
  "region": "africa",
  "sub_region": "west_africa",
  "is_digital_nomad_friendly": false,
  "has_digital_nomad_visa": false,
  "coordinates": {
    "lat": 5.6037,
    "lon": -0.187
  },
  "timezone": [
    "Africa/Accra"
  ],
  "currency": [
    {
      "code": "GHS",
      "name": "加纳塞地",
      "is_primary": true
    }
  ],
  "languages": [
    {
      "code": "en",
      "name": "英语",
      "is_official": true
    }
  ],
  "population": 32000000,
  "area_km2": 238533,
  "gdp_per_capita_usd": 2500,
  "hdi": 0.632,
  "safety_index": 60.0,
  "internet_speed_avg_mbps": 35,
  "cost_of_living_index": 38.0,
  "rent_index": 15.0,
  "china_passport_visa_status": "visa_required",
  "china_passport_visa_note": "需提前申请签证",
  "digital_nomad_score": 62,
  "tags": [
    "africa",
    "culture",
    "friendly",
    "beach",
    "gold"
  ],
  "status": "published",
  "updated_at": "2026-01-15T00:00:00Z",
  "source": "Numbeo 2026, World Bank 2025"
}
