{
  "id": "netherlands",
  "name": "荷兰",
  "name_en": "Netherlands",
  "name_local": "Nederland",
  "code_iso_3166_1": "NL",
  "code_iso_3166_3": "NLD",
  "region": "europe",
  "sub_region": "western_europe",
  "is_digital_nomad_friendly": true,
  "has_digital_nomad_visa": false,
  "coordinates": {
    "lat": 52.1326,
    "lon": 5.2913
  },
  "timezone": [
    "Europe/Amsterdam"
  ],
  "currency": [
    {
      "code": "EUR",
      "name": "欧元",
      "is_primary": true
    }
  ],
  "languages": [
    {
      "code": "nl",
      "name": "荷兰语",
      "is_official": true
    },
    {
      "code": "en",
      "name": "English",
      "is_official": false
    }
  ],
  "population": 17530000,
  "area_km2": 41543,
  "gdp_per_capita_usd": 57000,
  "hdi": 0.946,
  "safety_index": 72.0,
  "internet_speed_avg_mbps": 180,
  "cost_of_living_index": 78.0,
  "rent_index": 50.0,
  "china_passport_visa_status": "visa_required",
  "china_passport_visa_note": "申根签证C类；高技能移民签证；创业签证",
  "digital_nomad_score": 82,
  "tags": [
    "eu",
    "english_friendly",
    "startup",
    "bike",
    "europe"
  ],
  "status": "published",
  "updated_at": "2026-01-15T00:00:00Z",
  "source": "Numbeo 2026, World Bank 2025, Netherlands Immigration"
}