{
  "id": "mongolia",
  "name": "蒙古",
  "name_en": "Mongolia",
  "name_local": "Монгол",
  "code_iso_3166_1": "MN",
  "code_iso_3166_3": "MNG",
  "region": "asia",
  "sub_region": "东亚",
  "is_special_admin_region": false,
  "is_digital_nomad_friendly": true,
  "has_digital_nomad_visa": true,
  "coordinates": {
    "lat": 46.8625,
    "lon": 103.8467
  },
  "timezone": [
    "Asia/Ulaanbaatar"
  ],
  "currency": [
    {
      "code": "MNT",
      "name": "蒙古图格里克",
      "is_primary": true
    }
  ],
  "languages": [
    {
      "code": "mn",
      "name": "蒙古语",
      "is_official": true
    }
  ],
  "population": 3400000,
  "area_km2": 1564116,
  "gdp_per_capita_usd": 4300,
  "hdi": 0.739,
  "safety_index": 70,
  "internet_speed_avg_mbps": 20,
  "cost_of_living_index": 28,
  "rent_index": 10,
  "china_passport_visa_status": "visa_free",
  "china_passport_visa_note": "中国公民免签入境，可停留30天。也可申请数字游民签证（有效期1年）",
  "digital_nomad_score": 72,
  "tags": [
    "东亚",
    "免签",
    "数字游民签证",
    "草原",
    "游牧文化"
  ],
  "status": "published",
  "updated_at": "2026-01-15",
  "source": "Numbeo, World Bank"
}