{
  "id": "denmark",
  "name": "丹麦",
  "name_en": "Denmark",
  "name_local": "Danmark",
  "code_iso_3166_1": "DK",
  "code_iso_3166_3": "DNK",
  "region": "europe",
  "sub_region": "北欧",
  "is_special_admin_region": false,
  "is_digital_nomad_friendly": true,
  "has_digital_nomad_visa": false,
  "coordinates": {
    "lat": 56.2639,
    "lon": 9.5018
  },
  "timezone": [
    "Europe/Copenhagen"
  ],
  "currency": [
    {
      "code": "DKK",
      "name": "丹麦克朗",
      "is_primary": true
    }
  ],
  "languages": [
    {
      "code": "da",
      "name": "丹麦语",
      "is_official": true
    },
    {
      "code": "en",
      "name": "英语",
      "is_official": false
    }
  ],
  "population": 5800000,
  "area_km2": 43094,
  "gdp_per_capita_usd": 68000,
  "hdi": 0.952,
  "safety_index": 84,
  "internet_speed_avg_mbps": 150,
  "cost_of_living_index": 82,
  "rent_index": 50,
  "china_passport_visa_status": "visa_required",
  "china_passport_visa_note": "需提前申请申根签证。丹麦不提供专门的数字游民签证，但可申请工作许可",
  "digital_nomad_score": 77,
  "tags": [
    "北欧",
    "申根",
    "自行车",
    "乐高",
    "hygge"
  ],
  "status": "published",
  "updated_at": "2026-01-15",
  "source": "Numbeo, World Bank"
}