{
  "id": "srilanka",
  "name": "斯里兰卡",
  "name_en": "Sri Lanka",
  "name_local": "ශ්‍රී ලංකා",
  "code_iso_3166_1": "LK",
  "code_iso_3166_3": "LKA",
  "region": "asia",
  "sub_region": "南亚",
  "is_special_admin_region": false,
  "is_digital_nomad_friendly": true,
  "has_digital_nomad_visa": true,
  "coordinates": {
    "lat": 7.8731,
    "lon": 80.7718
  },
  "timezone": [
    "Asia/Colombo"
  ],
  "currency": [
    {
      "code": "LKR",
      "name": "斯里兰卡卢比",
      "is_primary": true
    }
  ],
  "languages": [
    {
      "code": "si",
      "name": "僧伽罗语",
      "is_official": true
    },
    {
      "code": "ta",
      "name": "泰米尔语",
      "is_official": true
    },
    {
      "code": "en",
      "name": "英语",
      "is_official": false
    }
  ],
  "population": 22000000,
  "area_km2": 65610,
  "gdp_per_capita_usd": 3300,
  "hdi": 0.782,
  "safety_index": 60,
  "internet_speed_avg_mbps": 20,
  "cost_of_living_index": 25,
  "rent_index": 10,
  "china_passport_visa_status": "evisa",
  "china_passport_visa_note": "可申请电子签证（ETA），有效期30天。也可申请数字游民签证（有效期1年）",
  "digital_nomad_score": 73,
  "tags": [
    "南亚",
    "数字游民签证",
    "茶园",
    "佛教",
    "海滩"
  ],
  "status": "published",
  "updated_at": "2026-01-15",
  "source": "Numbeo, World Bank"
}