{
  "id": "cyprus",
  "name": "塞浦路斯",
  "name_en": "Cyprus",
  "name_local": "Κύπρος / Kıbrıs",
  "code_iso_3166_1": "CY",
  "code_iso_3166_3": "CYP",
  "region": "europe",
  "sub_region": "南欧",
  "is_special_admin_region": false,
  "is_digital_nomad_friendly": true,
  "has_digital_nomad_visa": true,
  "coordinates": {"lat": 35.1264, "lon": 33.4299},
  "timezone": ["Asia/Nicosia"],
  "currency": [{"code": "EUR", "name": "欧元", "is_primary": true}],
  "languages": [{"code": "el", "name": "希腊语", "is_official": true}, {"code": "tr", "name": "土耳其语", "is_official": true}, {"code": "en", "name": "英语", "is_official": false}],
  "population": 1250000,
  "area_km2": 9251,
  "gdp_per_capita_usd": 31000,
  "hdi": 0.896,
  "safety_index": 82,
  "internet_speed_avg_mbps": 50,
  "cost_of_living_index": 55,
  "rent_index": 30,
  "china_passport_visa_status": "evisa",
  "china_passport_visa_note": "需提前申请签证，可在塞浦路斯外交部官网申请电子签证",
  "digital_nomad_score": 80,
  "tags": ["欧盟", "地中海", "数字游民签证", "税务优惠", "海岛"],
  "status": "published",
  "updated_at": "2026-01-15",
  "source": "Numbeo, World Bank, 塞浦路斯数字游民签证官网"
}