{
  "id": "indonesia",
  "name": "印度尼西亚",
  "name_en": "Indonesia",
  "name_local": "Indonesia",
  "code_iso_3166_1": "ID",
  "code_iso_3166_3": "IDN",
  "region": "asia",
  "sub_region": "东南亚",
  "is_special_admin_region": false,
  "is_digital_nomad_friendly": true,
  "has_digital_nomad_visa": true,
  "coordinates": {"lat": -0.7893, "lon": 113.9213},
  "timezone": ["Asia/Jakarta"],
  "currency": [{"code": "IDR", "name": "印尼盾", "is_primary": true}],
  "languages": [{"code": "id", "name": "印尼语", "is_official": true}, {"code": "en", "name": "英语", "is_official": false}],
  "population": 275000000,
  "area_km2": 1904569,
  "gdp_per_capita_usd": 4700,
  "hdi": 0.713,
  "safety_index": 58,
  "internet_speed_avg_mbps": 25,
  "cost_of_living_index": 32,
  "rent_index": 14,
  "china_passport_visa_status": "evisa",
  "china_passport_visa_note": "可申请电子签证（B211A），有效期60天，可延期。第二家园签证（Second Home Visa）可停留5-10年",
  "digital_nomad_score": 76,
  "tags": ["东南亚", "海岛", "低成本", "数字游民签证", "冲浪"],
  "status": "published",
  "updated_at": "2026-01-15",
  "source": "Numbeo, World Bank, 印尼移民局"
}